smartctl 7.4 2023-08-01 r5530 [x86_64-linux] (local build)

=== START OF READ SMART DATA SECTION ===
SMART Attributes Data Structure revision number: 16
Vendor Specific SMART Attributes with Thresholds:
ID# ATTRIBUTE_NAME          FLAG     VALUE WORST THRESH TYPE      UPDATED  WHEN_FAILED RAW_VALUE
  4 Start_Stop_Count        0x0012   098   098   000    Old_age   Always       -       9966
  5 Reallocated_Sector_Ct   0x0033   100   100   005    Pre-fail  Always       -       0
  9 Power_On_Hours          0x0012   094   094   000    Old_age   Always       -       43712
194 Temperature_Celsius     0x0002   171   171   000    Old_age   Always       -       38 (Min/Max 19/51)
197 Current_Pending_Sector  0x0022   100   100   000    Old_age   Always       -       0
198 Offline_Uncorrectable   0x0008   100   100   000    Old_age   Offline      -       0
199 UDMA_CRC_Error_Count    0x000a   200   200   000    Old_age   Always       -       1
